{"artistic_approval":"UNVERIFIED","canonical_sha256":"e822027dd4d1ccff40a6f176f7941a0bcc827fa340e2adb0203287d6953edaec","differences":{"blending_model":"Pillow CPU alpha-over (A over B) vs Korangar GPU Weighted Blended Order-Independent Transparency (WBOIT Rgba16Float accumulation + R8Unorm revealage post-process resolve).","coordinate_projection":"2D integer center placement ((width-1)//2, (height-1)//2) on fixed canvas vs 3D perspective camera billboard projection with depth testing.","motion_compaction":"Native Korangar loader skips zero-clip ACT motions during loading; Python timeline preserves raw motion ordinals with explicit RAW_MOTION_PREPARATION_PARITY_UNVERIFIED diagnostic."},"fidelity":{"geometry":"VERIFIED","limitations":["CPU Pillow ordered alpha-over composition; GPU WBOIT, native action-wide billboard bounds and cross-GPU pixel parity are not verified.","Korangar renders in 3D camera-facing billboard coordinate space with depth testing; preview renders on 2D integer-origin canvas.","Diagnostic preview parity evidence; technical structural equivalence only, no aesthetic or artistic approval."],"native_pixel_parity":"UNVERIFIED","overall":"PARTIAL"},"native_reference":{"entity_spirv_sha256":"27f65d9d3e302c7ddbb7104576fab61c1f797e71daf19228eb4cb64a4fe6f2ec","korangar_commit":"3f3d88a583203f09d079712f43343c1041258ffd","native_report_sha256":"f18296f381a3dd72c211da51ae29ddfcbdceb62994fbbac36e5424b6a7714f39","wboit_resolve_spirv_sha256":"2665d9ace894a006dbf2513d3f1eb6928ba0e6d816d7db4eb8b5c002f352e73e"},"results":{"anchor_placement_match":true,"layer_ordering_match":true,"layer_transforms_match":true,"mismatches_count":0,"slot_resolution_match":true,"timeline_stepping_match":true},"schema":"rsf.preview-parity-report/v1","scope":{"actors":["novice","orc"],"total_cases_evaluated":160,"total_frame_selections_evaluated":1664,"total_prepared_layers_evaluated":2688},"semantics":{"geometry":"1.0.0","parity":"1.0.0","renderer":"1.1.0","timing":"1.0.0"},"sources":{"novice_body_act":"a82086ba005506a16ee0740ebd1d33c43de8cc4ee1a622ea933ff9e0502c1c77","novice_body_spr":"7f4efe357b0f80e71ba2dcdb93d1c110988b1b8f382e1dbfc722e3a2cf85a533","novice_head_act":"96cb4c7daada65ead29ade650c34da1cba93937d3b360c5468506c3d056219de","novice_head_spr":"dfc548c5cfd9aeb66616c5912df78773c2798834f9412a309a5a2b4f5868ac95","orc_skeleton_act":"31e1e75241bc534422e468ae134892c7b234d66022456b87b0423df5858370e2","orc_skeleton_spr":"a39f864209d63ae75bd62438da61775c510d7c55a78344b3065fb5918a55ce8f"},"technical_difference_only":true}
